{
  "artifact_type": "ril_entropy_accumulation_long_horizon_decay_red_team_report",
  "artifact_version": "1.0.0",
  "schema_version": "1.0.0",
  "standards_version": "1.0.0",
  "record_id": "RIL-FAE001-REC-0001",
  "run_id": "FAE-001-RUN-0001",
  "plan_id": "PLAN-FAE-001-2026-04-16",
  "created_at": "2026-04-16T00:00:00Z",
  "owner_system": "RIL",
  "status": "completed",
  "evidence_refs": [
    "trace://fae-001/bootstrap"
  ],
  "details": {
    "batch": "FAE-001",
    "label": "FULL-AUTONOMY-EXECUTION-001"
  }
}
